{
  "$schema": "https://json-schema.org/draft/2020-12/schema",
  "$id": "https://skenion.dev/schemas/node-catalog/v0.1/node-catalog.schema.json",
  "title": "skenion Node Catalog Snapshot v0.1",
  "type": "object",
  "required": [
    "schema",
    "schemaVersion",
    "catalogRevision",
    "entries"
  ],
  "properties": {
    "schema": {
      "const": "skenion.node-catalog.snapshot"
    },
    "schemaVersion": {
      "const": "0.1.0"
    },
    "catalogRevision": {
      "$ref": "#/$defs/checksum"
    },
    "entries": {
      "type": "array",
      "items": {
        "$ref": "#/$defs/entry"
      }
    },
    "issues": {
      "type": "array",
      "items": {
        "$ref": "#/$defs/issue"
      }
    }
  },
  "additionalProperties": false,
  "$defs": {
    "checksum": {
      "type": "object",
      "required": ["algorithm", "value"],
      "properties": {
        "algorithm": {
          "const": "sha256"
        },
        "value": {
          "type": "string",
          "pattern": "^[a-f0-9]{64}$"
        }
      },
      "additionalProperties": false
    },
    "display": {
      "type": "object",
      "required": ["title"],
      "properties": {
        "title": {
          "type": "string",
          "minLength": 1
        },
        "category": {
          "oneOf": [{ "type": "string" }, { "type": "null" }]
        },
        "palette": {
          "oneOf": [{ "enum": ["direct", "text"] }, { "type": "null" }]
        },
        "description": {
          "oneOf": [{ "type": "string" }, { "type": "null" }]
        },
        "helpId": {
          "oneOf": [{ "type": "string" }, { "type": "null" }]
        }
      },
      "additionalProperties": false
    },
    "packageId": {
      "type": "string",
      "pattern": "^[a-z0-9](?:[a-z0-9-]*[a-z0-9])?/[a-z0-9](?:[a-z0-9-]*[a-z0-9])?$"
    },
    "objectProvider": {
      "oneOf": [
        {
          "type": "object",
          "required": ["kind"],
          "properties": {
            "kind": {
              "const": "core"
            }
          },
          "additionalProperties": false
        },
        {
          "type": "object",
          "required": ["kind", "patchId"],
          "properties": {
            "kind": {
              "const": "projectPatch"
            },
            "patchId": {
              "type": "string",
              "minLength": 1
            },
            "revision": {
              "type": "string",
              "minLength": 1
            },
            "interfaceRevision": {
              "type": "string",
              "minLength": 1
            },
            "interfaceDigest": {
              "$ref": "#/$defs/checksum"
            }
          },
          "additionalProperties": false
        },
        {
          "type": "object",
          "required": ["kind", "packageId"],
          "properties": {
            "kind": {
              "const": "package"
            },
            "packageId": {
              "$ref": "#/$defs/packageId"
            },
            "lockEntryId": {
              "type": "string",
              "minLength": 1
            },
            "version": {
              "type": "string",
              "minLength": 1
            }
          },
          "additionalProperties": false
        }
      ]
    },
    "issueTarget": {
      "oneOf": [
        {
          "type": "object",
          "required": ["kind"],
          "properties": {
            "kind": {
              "const": "catalog"
            }
          },
          "additionalProperties": false
        },
        {
          "type": "object",
          "required": ["kind", "catalogId"],
          "properties": {
            "kind": {
              "const": "entry"
            },
            "catalogId": {
              "type": "string",
              "minLength": 1
            }
          },
          "additionalProperties": false
        }
      ]
    },
    "issue": {
      "type": "object",
      "required": ["severity", "code", "message", "target"],
      "properties": {
        "severity": {
          "enum": ["info", "warning", "error"]
        },
        "code": {
          "type": "string",
          "minLength": 1
        },
        "message": {
          "type": "string",
          "minLength": 1
        },
        "target": {
          "$ref": "#/$defs/issueTarget"
        },
        "details": true
      },
      "additionalProperties": false
    },
    "entry": {
      "type": "object",
      "required": [
        "catalogId",
        "objectId",
        "primaryObjectSpec",
        "provider",
        "definition",
        "creatable",
        "display"
      ],
      "properties": {
        "catalogId": {
          "type": "string",
          "minLength": 1
        },
        "objectId": {
          "type": "string",
          "minLength": 1
        },
        "primaryObjectSpec": {
          "type": "string",
          "minLength": 1
        },
        "aliases": {
          "type": "array",
          "items": {
            "type": "string",
            "minLength": 1
          },
          "uniqueItems": true
        },
        "provider": {
          "$ref": "#/$defs/objectProvider"
        },
        "definition": {
          "$ref": "https://skenion.dev/schemas/node/v0.1/node-definition.schema.json"
        },
        "creatable": {
          "const": true
        },
        "display": {
          "$ref": "#/$defs/display"
        },
        "issues": {
          "type": "array",
          "items": {
            "$ref": "#/$defs/issue"
          }
        }
      },
      "additionalProperties": false
    }
  }
}
