{
  "schema": "skenion.node-catalog.snapshot",
  "schemaVersion": "0.1.0",
  "catalogRevision": {
    "algorithm": "sha256",
    "value": "b9c3c9483879f21696481b2634ffbcb9046b561b8ddedd01772dd4141f7fa538"
  },
  "entries": [
    {
      "catalogId": "core.float",
      "objectId": "float",
      "primaryObjectSpec": "float",
      "aliases": [
        "float64",
        "number"
      ],
      "provider": {
        "kind": "core"
      },
      "definition": {
        "schema": "skenion.node.definition",
        "schemaVersion": "0.1.0",
        "id": "object.core.float",
        "version": "0.1.0",
        "displayName": "Float",
        "category": "Core",
        "ports": [],
        "execution": {
          "model": "control"
        },
        "state": {
          "persistent": false
        },
        "permissions": [],
        "capabilities": []
      },
      "creatable": true,
      "display": {
        "title": "Float",
        "category": "Core",
        "palette": "text",
        "description": "Core scalar node.",
        "helpId": "object.core.float"
      },
      "issues": [
        {
          "severity": "info",
          "code": "catalog.note",
          "message": "Core scalar node.",
          "target": {
            "kind": "entry",
            "catalogId": "core.float"
          }
        }
      ]
    },
    {
      "catalogId": "core.message",
      "objectId": "message",
      "primaryObjectSpec": "message",
      "aliases": [
        "msg"
      ],
      "provider": {
        "kind": "core"
      },
      "definition": {
        "schema": "skenion.node.definition",
        "schemaVersion": "0.1.0",
        "id": "object.core.message",
        "version": "0.1.0",
        "displayName": "Message",
        "category": "Core",
        "ports": [],
        "execution": {
          "model": "control"
        },
        "state": {
          "persistent": false
        },
        "permissions": [],
        "capabilities": []
      },
      "creatable": true,
      "display": {
        "title": "Message",
        "category": "Core"
      }
    }
  ],
  "issues": [
    {
      "severity": "warning",
      "code": "catalog.generated",
      "message": "Generated with non-fatal catalog issues.",
      "target": {
        "kind": "catalog"
      }
    }
  ]
}
